{
  "id": "faye_valentine_ada_Faye_Valentine_20260822_184029_03",
  "stage": "illustrious",
  "verdict": "RETRY_ILLUSTRIOUS",
  "defects": [
    "Wrong identity: hair is purple and short, eyes are green — correct.",
    "Wrong identity: large breasts — correct.",
    "Scene requirement 'holding_torn_paper_over_midriff' is violated: the paper is on the desk, not held over midriff.",
    "Scene requirement 'irritated_expression' is present: facial expression shows irritation.",
    "Scene requirement 'dim_office_lighting' is present: lighting is dim with strong directional light.",
    "Canonical outfit: shirt is yellow crop top — correct.",
    "Canonical outfit: shorts — correct.",
    "Canonical outfit: thighhighs — not present, visible skin from waist to thighs.",
    "Canonical outfit: boots — present, light green boots — correct.",
    "Canonical outfit: hairband — present, orange hairband — correct.",
    "Canonical outfit: lipstick — present, red lips — correct.",
    "Canonical outfit: bare_shoulders — present — correct.",
    "Actual visible defects: paper is not held over midriff, it's on the desk.",
    "Narrative/compositional drift: the paper is not acting as a shield over midriff, violating strategic censorship intent."
  ],
  "drift": [
    "The torn paper is not held up to block the midriff; it is placed on the desk, which breaks the narrative of the interruption caused by an unseen superior's gaze."
  ],
  "summary": "The image fails because the critical scene requirement 'holding_torn_paper_over_midriff' is not met. The paper is on the desk, not held as a shield. This violates the strategic censorship premise and is a major structural failure."
}
