{
  "id": "faye_valentine_ada_Faye_Valentine_20260822_180015_01",
  "stage": "klein",
  "verdict": "MINOR_DEFECT",
  "preserved_ok": [
    "purple_hair",
    "short_hair",
    "green_eyes",
    "large_breasts",
    "hairband",
    "shorts",
    "lipstick",
    "thighhighs",
    "shirt",
    "bare_shoulders",
    "crop_top",
    "boots"
  ],
  "defects": [
    "The single sheet of paper is not visibly fluttering or in motion; it appears static and partially obscures the chest area, failing to convey the dynamic interruption as specified."
  ],
  "drift": [
    "The paper is positioned too low and static, not appearing to fall from an unseen source above. The framing and composition do not emphasize the paper as the cause of interruption, reducing narrative impact."
  ],
  "summary": "The character’s core visual identity and pose are preserved. The primary defect is the lack of dynamic paper motion and its static placement, which undermines the intended narrative of interruption. This is a minor visual drift, not a structural failure."
}
