{
  "id": "faye_valentine_ada_Faye_Valentine_20260822_185027_03",
  "stage": "klein",
  "verdict": "RETRY_ILLUSTRIOUS",
  "defects": [
    "Immutable identity failure: hair is purple and short, eyes are green — correct. However, the paper is held in a way that does not fully obscure the midriff as required. The paper is held low, partially covering the waist but not the central torso area as specified. This violates the strategic censorship requirement.",
    "Scene requirement failure: 'holding_torn_paper_over_midriff' is not met. The paper is held at waist level, not over the midriff. The 'harsh_overhead_lighting' and 'dimly_lit_office_environment' are visually present but the paper's placement fails the core censorship intent.",
    "Narrative drift: The paper is held as if to shield from light, but it does not fulfill the 'tactical weapon' narrative. The paper is not obscuring the torso as intended, which breaks the premise’s strategic censorship goal. The character’s expression is irritated, but the paper’s placement undermines the scene’s tension.",
    "Minor rendering issue: The paper’s text is illegible and appears to be placeholder text, which is not a critical failure but a polishable defect."
  ],
  "drift": [
    "The paper is held too low, failing to obscure the midriff as required by the premise. This is a critical failure because the premise explicitly requires the paper to act as a 'tactical weapon' obscuring the torso. The current placement does not achieve this.",
    "The lighting is dim and overhead, but the paper’s placement does not create the intended visual effect of shielding from light. This is a narrative drift because the paper’s function is misaligned with the premise’s intent."
  ],
  "summary": "The image fails the critical 'holding_torn_paper_over_midriff' requirement. The paper is held too low, not obscuring the central torso area as required for strategic censorship. This is a major structural failure under the new identity contract. The paper’s placement undermines the narrative’s tension and intent. The character’s identity elements are correct, but the scene requirement is critically violated."
}
